{
  "$schema": "https://json-schema.org/draft/2020-12/schema",
  "$id": "https://benzemaer.local/schemas/sidecar/exp_a04_pcvt_raw_accepted_handoff.schema.json",
  "title": "Accepted PCVT raw materialization handoff for EXP-A04",
  "type": "object",
  "additionalProperties": false,
  "required": ["$schema", "task_id", "program_id", "source_task_id", "accepted_run_id", "materialization_id", "status", "formal_data_version", "artifact", "key_mapping", "indicator_registry", "accepted_evidence", "accepted_validation", "raw_artifact_generated_by_A04", "existing_PCVT_indicator_modified", "existing_PCVT_raw_modified"],
  "properties": {
    "$schema": {"const": "../../schemas/sidecar/exp_a04_pcvt_raw_accepted_handoff.schema.json"}, "task_id": {"const": "EXP-A04"}, "program_id": {"const": "EXP-A"}, "source_task_id": {"const": "R0-T10-01"}, "accepted_run_id": {"const": "R0-T10-01-20260708T1715Z"}, "materialization_id": {"const": "R0-T10-01-20260708T1715Z:r0_t04"}, "status": {"const": "accepted"}, "formal_data_version": {"const": false},
    "artifact": {"type": "object", "additionalProperties": false, "required": ["logical_object", "path", "filename", "table", "sha256", "row_count", "expected_key_count", "actual_key_count", "security_count", "date_min", "date_max"], "properties": {"logical_object": {"const": "r0_t04_raw_metric_results"}, "path": {"const": "data/generated/r0/r0_t10/R0-T10-01-20260708T1715Z/r0_t04/r0_t04_raw_metric_results.duckdb"}, "filename": {"const": "r0_t04_raw_metric_results.duckdb"}, "table": {"const": "r0_t04_raw_metric_results"}, "sha256": {"const": "89ff2979f8e151c1611c0c61b1b547783f76a4ad94953c9252b0ecef98ed56a0"}, "row_count": {"const": 13846152}, "expected_key_count": {"const": 1730769}, "actual_key_count": {"const": 1730769}, "security_count": {"const": 800}, "date_min": {"const": "2016-01-04"}, "date_max": {"const": "2026-06-30"}}},
    "key_mapping": {"type": "object", "additionalProperties": false, "required": ["security_id", "trading_date", "observation_sequence", "join_policy"], "properties": {"security_id": {"const": "security_id"}, "trading_date": {"const": "trading_date"}, "observation_sequence": {"const": null}, "join_policy": {"const": "security_id+trading_date_after_strict_uniqueness_proof"}}},
    "indicator_registry": {"type": "array", "minItems": 8, "maxItems": 8, "items": {"type": "object", "additionalProperties": false, "required": ["indicator_id", "layer", "raw_metric_name", "direction"], "properties": {"indicator_id": {"type": "string"}, "layer": {"enum": ["P", "C", "T", "V"]}, "raw_metric_name": {"type": "string"}, "direction": {"const": "lower_is_more_convergent"}}}},
    "accepted_evidence": {"type": "array", "minItems": 4, "items": {"type": "object", "additionalProperties": false, "required": ["evidence_id", "path", "sha256", "status"], "properties": {"evidence_id": {"type": "string"}, "path": {"type": "string"}, "sha256": {"type": "string", "pattern": "^[0-9a-f]{64}$"}, "status": {"const": "accepted"}, "source_commit": {"type": "string", "pattern": "^[0-9a-f]{40}$"}, "git_blob_sha": {"type": "string", "pattern": "^[0-9a-f]{40}$"}}}},
    "accepted_validation": {"type": "object", "additionalProperties": false, "required": ["status", "validator_status", "forbidden_field_check", "legacy_v1_check", "row_count", "security_count", "date_min", "date_max"], "properties": {"status": {"const": "passed"}, "validator_status": {"const": "passed"}, "forbidden_field_check": {"const": "passed"}, "legacy_v1_check": {"const": "passed"}, "row_count": {"const": 13846152}, "security_count": {"const": 800}, "date_min": {"const": "2016-01-04"}, "date_max": {"const": "2026-06-30"}}},
    "raw_artifact_generated_by_A04": {"const": false}, "existing_PCVT_indicator_modified": {"const": false}, "existing_PCVT_raw_modified": {"const": false}
  }
}
