{"$schema":"../../schemas/sidecar/exp_a04_pcvt_raw_accepted_handoff.schema.json","accepted_evidence":[{"evidence_id":"r0_t10_01_repair_evidence","git_blob_sha":"ee3e01c4ddf34600db94eeeec8e7d4ae56ed9282","path":"docs/evidence/r0/R0-T10-01_r0_t04_raw_metrics_materialization_evidence_repair_20260708T1715Z.md","sha256":"732a0fb622d1bc78d80383a35dd1a142a32626935e9b156216517f1291bc1df9","source_commit":"66a96f8fe7cf6cc1b3f2ccd98d6f89a5f1115094","status":"accepted"},{"evidence_id":"r0_evidence_index","git_blob_sha":"92aa5d3dffbde38ed53847deac76c8f742d5b43f","path":"docs/reports/r0/R0_evidence_index.md","sha256":"671174159c74bc79265e321fd5c3104bb13b49741e745d05c98a7ae533838800","source_commit":"66a96f8fe7cf6cc1b3f2ccd98d6f89a5f1115094","status":"accepted"},{"evidence_id":"r0_audit_report","git_blob_sha":"aecc73258d4405895d9f0bcfcf4f496131e98481","path":"docs/reports/r0/R0_audit_report.md","sha256":"6c0c470c36e42c4cdd92906b17ada97ab54bfb475dd75b29ad3a437537717add","source_commit":"66a96f8fe7cf6cc1b3f2ccd98d6f89a5f1115094","status":"accepted"},{"evidence_id":"r0_t10_05_input_binding_evidence","git_blob_sha":"c950568439f4b06610a821194433cb71efe0420e","path":"docs/evidence/r0/R0-T10-05_authorized_input_manifest_full_grid_evidence.md","sha256":"25b6176de27add5532bb0a3809b6b7e0fd8403ef350f82685faa9cb5a0a52dab","source_commit":"66a96f8fe7cf6cc1b3f2ccd98d6f89a5f1115094","status":"accepted"}],"accepted_run_id":"R0-T10-01-20260708T1715Z","accepted_validation":{"date_max":"2026-06-30","date_min":"2016-01-04","forbidden_field_check":"passed","legacy_v1_check":"passed","row_count":13846152,"security_count":800,"status":"passed","validator_status":"passed"},"artifact":{"actual_key_count":1730769,"date_max":"2026-06-30","date_min":"2016-01-04","expected_key_count":1730769,"filename":"r0_t04_raw_metric_results.duckdb","logical_object":"r0_t04_raw_metric_results","path":"data/generated/r0/r0_t10/R0-T10-01-20260708T1715Z/r0_t04/r0_t04_raw_metric_results.duckdb","row_count":13846152,"security_count":800,"sha256":"89ff2979f8e151c1611c0c61b1b547783f76a4ad94953c9252b0ecef98ed56a0","table":"r0_t04_raw_metric_results"},"existing_PCVT_indicator_modified":false,"existing_PCVT_raw_modified":false,"formal_data_version":false,"indicator_registry":[{"direction":"lower_is_more_convergent","indicator_id":"P1_NATR14","layer":"P","raw_metric_name":"NATR14"},{"direction":"lower_is_more_convergent","indicator_id":"P2_LogRange20","layer":"P","raw_metric_name":"LogRange20"},{"direction":"lower_is_more_convergent","indicator_id":"C1_LogMASpread_5_60","layer":"C","raw_metric_name":"LogMASpread_5_60"},{"direction":"lower_is_more_convergent","indicator_id":"C2_AdjVWAPSpread_5_60","layer":"C","raw_metric_name":"AdjVWAPSpread_5_60"},{"direction":"lower_is_more_convergent","indicator_id":"T1_ER20","layer":"T","raw_metric_name":"ER20"},{"direction":"lower_is_more_convergent","indicator_id":"T2_AbsTrendT20","layer":"T","raw_metric_name":"AbsTrendT20"},{"direction":"lower_is_more_convergent","indicator_id":"V1_TurnoverShrink20_60","layer":"V","raw_metric_name":"TurnoverShrink20_60"},{"direction":"lower_is_more_convergent","indicator_id":"V2_LogAmount20_base","layer":"V","raw_metric_name":"LogAmount20"}],"key_mapping":{"join_policy":"security_id+trading_date_after_strict_uniqueness_proof","observation_sequence":null,"security_id":"security_id","trading_date":"trading_date"},"materialization_id":"R0-T10-01-20260708T1715Z:r0_t04","program_id":"EXP-A","raw_artifact_generated_by_A04":false,"source_task_id":"R0-T10-01","status":"accepted","task_id":"EXP-A04"}
